{
  "schema_version": "1.0.0",
  "closure_attestation_id": "CA-001",
  "issue_id": "ISSUE-001",
  "r4_phase_plan_id": "R4PLAN-001",
  "closure_manifest_artifact_key": {
    "artifact_id": "CM-001",
    "artifact_revision": "rev-0001"
  },
  "final_manifest_anchors": [
    {
      "manifest_anchor_id": "ANCHOR-001",
      "manifest_id": "AM-001",
      "manifest_revision": "rev-0001",
      "immutable_path": "manifests/AM-001-rev-0001.json",
      "manifest_sha256": "aaaaaaaaaaaaaaaaaaaaaaaaaaaaaaaaaaaaaaaaaaaaaaaaaaaaaaaaaaaaaaaa",
      "storage_scope": "repository-redacted",
      "git_commit_sha": "bbbbbbbbbbbbbbbbbbbbbbbbbbbbbbbbbbbbbbbb",
      "signature": null
    }
  ],
  "validation_result": "pass",
  "derived_closure_state": "closed",
  "timestamp": "2026-06-16T00:00:00Z",
  "actor": "human",
  "notes": "minimal sample"
}
